land_class,default_weight,weight_note
high_suitability_plantation,1.0,High-suitability commercial plantation land.
moderate_suitability_plantation,0.65,Moderate-suitability commercial plantation land.
restorable_commercial_forest,0.4,Historically depleted but commercially restorable forestry land.
marginal_forestry,0.15,Marginal forestry land that can support only thin commercial activity.
noncommercial_wooded_land,0.0,Wooded land that is not meaningfully commercial forestry.
arid_or_unusable,0.0,Arid or otherwise unusable forestry land.
